id,title,slug,price,description,images,creationAt,updatedAt,category.id,category.name,category.slug,category.image,category.creationAt,category.updatedAt
16,Classic White Tee - Timeless Style and Comfort,classic-white-tee-timeless-style-and-comfort,73,"Elevate your everyday wardrobe with our Classic White Tee. Crafted from premium soft cotton material, this versatile t-shirt combines comfort with durability, perfect for daily wear. Featuring a relaxed, unisex fit that flatters every body type, it's a staple piece for any casual ensemble. Easy to care for and machine washable, this white tee retains its shape and softness wash after wash. Pair it with your favorite jeans or layer it under a jacket for a smart look.","['https://i.imgur.com/Y54Bt8J.jpeg', 'https://i.imgur.com/SZPDSgy.jpeg', 'https://i.imgur.com/sJv4Xx0.jpeg']",2025-11-29T01:49:03.000Z,2025-11-29T01:49:03.000Z,1,Clothes,clothes,https://i.imgur.com/QkIa5tT.jpeg,2025-11-29T01:49:03.000Z,2025-11-29T01:49:03.000Z
17,Classic Black T-Shirt,classic-black-t-shirt,35,"Elevate your everyday style with our Classic Black T-Shirt. This staple piece is crafted from soft, breathable cotton for all-day comfort. Its versatile design features a classic crew neck and short sleeves, making it perfect for layering or wearing on its own. Durable and easy to care for, it's sure to become a favorite in your wardrobe.","['https://i.imgur.com/9DqEOV5.jpeg', 'https://i.imgur.com/ae0AEYn.jpeg', 'https://i.imgur.com/mZ4rUjj.jpeg']",2025-11-29T01:49:03.000Z,2025-11-29T01:49:03.000Z,1,Clothes,clothes,https://i.imgur.com/QkIa5tT.jpeg,2025-11-29T01:49:03.000Z,2025-11-29T01:49:03.000Z
18,Sleek White & Orange Wireless Gaming Controller,sleek-white-orange-wireless-gaming-controller,69,"Elevate your gaming experience with this state-of-the-art wireless controller, featuring a crisp white base with vibrant orange accents. Designed for precision play, the ergonomic shape and responsive buttons provide maximum comfort and control for endless hours of gameplay. Compatible with multiple gaming platforms, this controller is a must-have for any serious gamer looking to enhance their setup.","['https://i.imgur.com/ZANVnHE.jpeg', 'https://i.imgur.com/Ro5z6Tn.jpeg', 'https://i.imgur.com/woA93Li.jpeg']",2025-11-29T01:49:03.000Z,2025-11-29T01:49:03.000Z,2,Electronics,electronics,https://i.imgur.com/ZANVnHE.jpeg,2025-11-29T01:49:03.000Z,2025-11-29T01:49:03.000Z
19,Sleek Wireless Headphone & Inked Earbud Set,sleek-wireless-headphone-inked-earbud-set,44,"Experience the fusion of style and sound with this sophisticated audio set featuring a pair of sleek, white wireless headphones offering crystal-clear sound quality and over-ear comfort. The set also includes a set of durable earbuds, perfect for an on-the-go lifestyle. Elevate your music enjoyment with this versatile duo, designed to cater to all your listening needs.","['https://i.imgur.com/yVeIeDa.jpeg', 'https://i.imgur.com/jByJ4ih.jpeg', 'https://i.imgur.com/KXj6Tpb.jpeg']",2025-11-29T01:49:03.000Z,2025-11-29T01:49:03.000Z,2,Electronics,electronics,https://i.imgur.com/ZANVnHE.jpeg,2025-11-29T01:49:03.000Z,2025-11-29T01:49:03.000Z
20,Sleek Comfort-Fit Over-Ear Headphones,sleek-comfort-fit-over-ear-headphones,28,"Experience superior sound quality with our Sleek Comfort-Fit Over-Ear Headphones, designed for prolonged use with cushioned ear cups and an adjustable, padded headband. Ideal for immersive listening, whether you're at home, in the office, or on the move. Their durable construction and timeless design provide both aesthetically pleasing looks and long-lasting performance.","['https://i.imgur.com/SolkFEB.jpeg', 'https://i.imgur.com/KIGW49u.jpeg', 'https://i.imgur.com/mWwek7p.jpeg']",2025-11-29T01:49:03.000Z,2025-11-29T01:49:03.000Z,2,Electronics,electronics,https://i.imgur.com/ZANVnHE.jpeg,2025-11-29T01:49:03.000Z,2025-11-29T01:49:03.000Z
21,Efficient 2-Slice Toaster,efficient-2-slice-toaster,48,"Enhance your morning routine with our sleek 2-slice toaster, featuring adjustable browning controls and a removable crumb tray for easy cleaning. This compact and stylish appliance is perfect for any kitchen, ensuring your toast is always golden brown and delicious.","['https://i.imgur.com/keVCVIa.jpeg', 'https://i.imgur.com/afHY7v2.jpeg', 'https://i.imgur.com/yAOihUe.jpeg']",2025-11-29T01:49:03.000Z,2025-11-29T01:49:03.000Z,2,Electronics,electronics,https://i.imgur.com/ZANVnHE.jpeg,2025-11-29T01:49:03.000Z,2025-11-29T01:49:03.000Z
22,Sleek Wireless Computer Mouse,sleek-wireless-computer-mouse,10,"Experience smooth and precise navigation with this modern wireless mouse, featuring a glossy finish and a comfortable ergonomic design. Its responsive tracking and easy-to-use interface make it the perfect accessory for any desktop or laptop setup. The stylish blue hue adds a splash of color to your workspace, while its compact size ensures it fits neatly in your bag for on-the-go productivity.","['https://i.imgur.com/w3Y8NwQ.jpeg', 'https://i.imgur.com/WJFOGIC.jpeg', 'https://i.imgur.com/dV4Nklf.jpeg']",2025-11-29T01:49:03.000Z,2025-11-29T01:49:03.000Z,2,Electronics,electronics,https://i.imgur.com/ZANVnHE.jpeg,2025-11-29T01:49:03.000Z,2025-11-29T01:49:03.000Z
24,Sleek Modern Laptop for Professionals,sleek-modern-laptop-for-professionals,97,"Experience cutting-edge technology and elegant design with our latest laptop model. Perfect for professionals on-the-go, this high-performance laptop boasts a powerful processor, ample storage, and a long-lasting battery life, all encased in a lightweight, slim frame for ultimate portability. Shop now to elevate your work and play.","['https://i.imgur.com/ItHcq7o.jpeg', 'https://i.imgur.com/55GM3XZ.jpeg', 'https://i.imgur.com/tcNJxoW.jpeg']",2025-11-29T01:49:03.000Z,2025-11-29T01:49:03.000Z,2,Electronics,electronics,https://i.imgur.com/ZANVnHE.jpeg,2025-11-29T01:49:03.000Z,2025-11-29T01:49:03.000Z
25,Stylish Red & Silver Over-Ear Headphones,stylish-red-silver-over-ear-headphones,39,"Immerse yourself in superior sound quality with these sleek red and silver over-ear headphones. Designed for comfort and style, the headphones feature cushioned ear cups, an adjustable padded headband, and a detachable red cable for easy storage and portability. Perfect for music lovers and audiophiles who value both appearance and audio fidelity.","['https://i.imgur.com/YaSqa06.jpeg', 'https://i.imgur.com/isQAliJ.jpeg', 'https://i.imgur.com/5B8UQfh.jpeg']",2025-11-29T01:49:03.000Z,2025-11-29T01:49:03.000Z,2,Electronics,electronics,https://i.imgur.com/ZANVnHE.jpeg,2025-11-29T01:49:03.000Z,2025-11-29T01:49:03.000Z
26,Sleek Mirror Finish Phone Case,sleek-mirror-finish-phone-case,27,"Enhance your smartphone's look with this ultra-sleek mirror finish phone case. Designed to offer style with protection, the case features a reflective surface that adds a touch of elegance while keeping your device safe from scratches and impacts. Perfect for those who love a minimalist and modern aesthetic.","['https://i.imgur.com/yb9UQKL.jpeg', 'https://i.imgur.com/m2owtQG.jpeg', 'https://i.imgur.com/bNiORct.jpeg']",2025-11-29T01:49:03.000Z,2025-11-29T01:49:03.000Z,2,Electronics,electronics,https://i.imgur.com/ZANVnHE.jpeg,2025-11-29T01:49:03.000Z,2025-11-29T01:49:03.000Z
27,Sleek Smartwatch with Vibrant Display,sleek-smartwatch-with-vibrant-display,16,"Experience modern timekeeping with our high-tech smartwatch, featuring a vivid touch screen display, customizable watch faces, and a comfortable blue silicone strap. This smartwatch keeps you connected with notifications and fitness tracking while showcasing exceptional style and versatility.","['https://i.imgur.com/LGk9Jn2.jpeg', 'https://i.imgur.com/1ttYWaI.jpeg', 'https://i.imgur.com/sPRWnJH.jpeg']",2025-11-29T01:49:03.000Z,2025-11-29T01:49:03.000Z,2,Electronics,electronics,https://i.imgur.com/ZANVnHE.jpeg,2025-11-29T01:49:03.000Z,2025-11-29T01:49:03.000Z
28,Sleek Modern Leather Sofa,sleek-modern-leather-sofa,53,"Enhance the elegance of your living space with our Sleek Modern Leather Sofa. Designed with a minimalist aesthetic, it features clean lines and a luxurious leather finish. The robust metal legs provide stability and support, while the plush cushions ensure comfort. Perfect for contemporary homes or office waiting areas, this sofa is a statement piece that combines style with practicality.","['https://i.imgur.com/Qphac99.jpeg', 'https://i.imgur.com/dJjpEgG.jpeg', 'https://i.imgur.com/MxJyADq.jpeg']",2025-11-29T01:49:03.000Z,2025-11-29T01:49:03.000Z,3,Furniture,furniture,https://i.imgur.com/Qphac99.jpeg,2025-11-29T01:49:03.000Z,2025-11-29T01:49:03.000Z
29,Mid-Century Modern Wooden Dining Table,mid-century-modern-wooden-dining-table,24,"Elevate your dining room with this sleek Mid-Century Modern dining table, featuring an elegant walnut finish and tapered legs for a timeless aesthetic. Its sturdy wood construction and minimalist design make it a versatile piece that fits with a variety of decor styles. Perfect for intimate dinners or as a stylish spot for your morning coffee.","['https://i.imgur.com/DMQHGA0.jpeg', 'https://i.imgur.com/qrs9QBg.jpeg', 'https://i.imgur.com/XVp8T1I.jpeg']",2025-11-29T01:49:03.000Z,2025-11-29T01:49:03.000Z,3,Furniture,furniture,https://i.imgur.com/Qphac99.jpeg,2025-11-29T01:49:03.000Z,2025-11-29T01:49:03.000Z
30,Elegant Golden-Base Stone Top Dining Table,elegant-golden-base-stone-top-dining-table,66,"Elevate your dining space with this luxurious table, featuring a sturdy golden metal base with an intricate rod design that provides both stability and chic elegance. The smooth stone top in a sleek round shape offers a robust surface for your dining pleasure. Perfect for both everyday meals and special occasions, this table easily complements any modern or glam decor.","['https://i.imgur.com/NWIJKUj.jpeg', 'https://i.imgur.com/Jn1YSLk.jpeg', 'https://i.imgur.com/VNZRvx5.jpeg']",2025-11-29T01:49:03.000Z,2025-11-29T01:49:03.000Z,3,Furniture,furniture,https://i.imgur.com/Qphac99.jpeg,2025-11-29T01:49:03.000Z,2025-11-29T01:49:03.000Z
31,Modern Elegance Teal Armchair,modern-elegance-teal-armchair,25,"Elevate your living space with this beautifully crafted armchair, featuring a sleek wooden frame that complements its vibrant teal upholstery. Ideal for adding a pop of color and contemporary style to any room, this chair provides both superb comfort and sophisticated design. Perfect for reading, relaxing, or creating a cozy conversation nook.","['https://i.imgur.com/6wkyyIN.jpeg', 'https://i.imgur.com/Ald3Rec.jpeg', 'https://i.imgur.com/dIqo03c.jpeg']",2025-11-29T01:49:03.000Z,2025-11-29T01:49:03.000Z,3,Furniture,furniture,https://i.imgur.com/Qphac99.jpeg,2025-11-29T01:49:03.000Z,2025-11-29T01:49:03.000Z
32,Elegant Solid Wood Dining Table,elegant-solid-wood-dining-table,67,"Enhance your dining space with this sleek, contemporary dining table, crafted from high-quality solid wood with a warm finish. Its sturdy construction and minimalist design make it a perfect addition for any home looking for a touch of elegance. Accommodates up to six guests comfortably and includes a striking fruit bowl centerpiece. The overhead lighting is not included.","['https://i.imgur.com/4lTaHfF.jpeg', 'https://i.imgur.com/JktHE1C.jpeg', 'https://i.imgur.com/cQeXQMi.jpeg']",2025-11-29T01:49:03.000Z,2025-11-29T01:49:03.000Z,3,Furniture,furniture,https://i.imgur.com/Qphac99.jpeg,2025-11-29T01:49:03.000Z,2025-11-29T01:49:03.000Z
33,Modern Minimalist Workstation Setup,modern-minimalist-workstation-setup,49,"Elevate your home office with our Modern Minimalist Workstation Setup, featuring a sleek wooden desk topped with an elegant computer, stylish adjustable wooden desk lamp, and complimentary accessories for a clean, productive workspace. This setup is perfect for professionals seeking a contemporary look that combines functionality with design.","['https://i.imgur.com/3oXNBst.jpeg', 'https://i.imgur.com/ErYYZnT.jpeg', 'https://i.imgur.com/boBPwYW.jpeg']",2025-11-29T01:49:03.000Z,2025-11-29T01:49:03.000Z,3,Furniture,furniture,https://i.imgur.com/Qphac99.jpeg,2025-11-29T01:49:03.000Z,2025-11-29T01:49:03.000Z
34,Modern Ergonomic Office Chair,modern-ergonomic-office-chair,71,"Elevate your office space with this sleek and comfortable Modern Ergonomic Office Chair. Designed to provide optimal support throughout the workday, it features an adjustable height mechanism, smooth-rolling casters for easy mobility, and a cushioned seat for extended comfort. The clean lines and minimalist white design make it a versatile addition to any contemporary workspace.","['https://i.imgur.com/3dU0m72.jpeg', 'https://i.imgur.com/zPU3EVa.jpeg']",2025-11-29T01:49:03.000Z,2025-11-29T01:49:03.000Z,3,Furniture,furniture,https://i.imgur.com/Qphac99.jpeg,2025-11-29T01:49:03.000Z,2025-11-29T01:49:03.000Z
35,Futuristic Holographic Soccer Cleats,futuristic-holographic-soccer-cleats,39,"Step onto the field and stand out from the crowd with these eye-catching holographic soccer cleats. Designed for the modern player, these cleats feature a sleek silhouette, lightweight construction for maximum agility, and durable studs for optimal traction. The shimmering holographic finish reflects a rainbow of colors as you move, ensuring that you'll be noticed for both your skills and style. Perfect for the fashion-forward athlete who wants to make a statement.","['https://i.imgur.com/qNOjJje.jpeg', 'https://i.imgur.com/NjfCFnu.jpeg', 'https://i.imgur.com/eYtvXS1.jpeg']",2025-11-29T01:49:03.000Z,2025-11-29T01:49:03.000Z,4,Shoes,shoes,https://i.imgur.com/qNOjJje.jpeg,2025-11-29T01:49:03.000Z,2025-11-29T01:49:03.000Z
37,Chic Summer Denim Espadrille Sandals,chic-summer-denim-espadrille-sandals,33,"Step into summer with style in our denim espadrille sandals. Featuring a braided jute sole for a classic touch and adjustable denim straps for a snug fit, these sandals offer both comfort and a fashionable edge. The easy slip-on design ensures convenience for beach days or casual outings.","['https://i.imgur.com/9qrmE1b.jpeg', 'https://i.imgur.com/wqKxBVH.jpeg', 'https://i.imgur.com/sWSV6DK.jpeg']",2025-11-29T01:49:03.000Z,2025-11-29T01:49:03.000Z,4,Shoes,shoes,https://i.imgur.com/qNOjJje.jpeg,2025-11-29T01:49:03.000Z,2025-11-29T01:49:03.000Z
38,Vibrant Runners: Bold Orange & Blue Sneakers,vibrant-runners-bold-orange-blue-sneakers,27,"Step into style with these eye-catching sneakers featuring a striking combination of orange and blue hues. Designed for both comfort and fashion, these shoes come with flexible soles and cushioned insoles, perfect for active individuals who don't compromise on style. The reflective silver accents add a touch of modernity, making them a standout accessory for your workout or casual wear.","['https://i.imgur.com/hKcMNJs.jpeg', 'https://i.imgur.com/NYToymX.jpeg', 'https://i.imgur.com/HiiapCt.jpeg']",2025-11-29T01:49:03.000Z,2025-11-29T01:49:03.000Z,4,Shoes,shoes,https://i.imgur.com/qNOjJje.jpeg,2025-11-29T01:49:03.000Z,2025-11-29T01:49:03.000Z
39,Vibrant Pink Classic Sneakers,vibrant-pink-classic-sneakers,84,"Step into style with our Vibrant Pink Classic Sneakers! These eye-catching shoes feature a bold pink hue with iconic white detailing, offering a sleek, timeless design. Constructed with durable materials and a comfortable fit, they are perfect for those seeking a pop of color in their everyday footwear. Grab a pair today and add some vibrancy to your step!","['https://i.imgur.com/mcW42Gi.jpeg', 'https://i.imgur.com/mhn7qsF.jpeg', 'https://i.imgur.com/F8vhnFJ.jpeg']",2025-11-29T01:49:03.000Z,2025-11-29T01:49:03.000Z,4,Shoes,shoes,https://i.imgur.com/qNOjJje.jpeg,2025-11-29T01:49:03.000Z,2025-11-29T01:49:03.000Z
40,Futuristic Silver and Gold High-Top Sneaker,futuristic-silver-and-gold-high-top-sneaker,68,"Step into the future with this eye-catching high-top sneaker, designed for those who dare to stand out. The sneaker features a sleek silver body with striking gold accents, offering a modern twist on classic footwear. Its high-top design provides support and style, making it the perfect addition to any avant-garde fashion collection. Grab a pair today and elevate your shoe game!","['https://i.imgur.com/npLfCGq.jpeg', 'https://i.imgur.com/vYim3gj.jpeg', 'https://i.imgur.com/HxuHwBO.jpeg']",2025-11-29T01:49:03.000Z,2025-11-29T01:49:03.000Z,4,Shoes,shoes,https://i.imgur.com/qNOjJje.jpeg,2025-11-29T01:49:03.000Z,2025-11-29T01:49:03.000Z
41,Futuristic Chic High-Heel Boots,futuristic-chic-high-heel-boots,36,"Elevate your style with our cutting-edge high-heel boots that blend bold design with avant-garde aesthetics. These boots feature a unique color-block heel, a sleek silhouette, and a versatile light grey finish that pairs easily with any cutting-edge outfit. Crafted for the fashion-forward individual, these boots are sure to make a statement.","['https://i.imgur.com/HqYqLnW.jpeg', 'https://i.imgur.com/RlDGnZw.jpeg', 'https://i.imgur.com/qa0O6fg.jpeg']",2025-11-29T01:49:03.000Z,2025-11-29T01:49:03.000Z,4,Shoes,shoes,https://i.imgur.com/qNOjJje.jpeg,2025-11-29T01:49:03.000Z,2025-11-29T01:49:03.000Z
42,Elegant Patent Leather Peep-Toe Pumps with Gold-Tone Heel,elegant-patent-leather-peep-toe-pumps,53,"Step into sophistication with these chic peep-toe pumps, showcasing a lustrous patent leather finish and an eye-catching gold-tone block heel. The ornate buckle detail adds a touch of glamour, perfect for elevating your evening attire or complementing a polished daytime look.","['https://i.imgur.com/AzAY4Ed.jpeg', 'https://i.imgur.com/umfnS9P.jpeg', 'https://i.imgur.com/uFyuvLg.jpeg']",2025-11-29T01:49:03.000Z,2025-11-29T01:49:03.000Z,4,Shoes,shoes,https://i.imgur.com/qNOjJje.jpeg,2025-11-29T01:49:03.000Z,2025-11-29T01:49:03.000Z
43,Elegant Purple Leather Loafers,elegant-purple-leather-loafers,17,"Step into sophistication with our Elegant Purple Leather Loafers, perfect for making a bold statement. Crafted from high-quality leather with a vibrant purple finish, these shoes feature a classic loafer silhouette that's been updated with a contemporary twist. The comfortable slip-on design and durable soles ensure both style and functionality for the modern man.","['https://i.imgur.com/Au8J9sX.jpeg', 'https://i.imgur.com/gdr8BW2.jpeg', 'https://i.imgur.com/KDCZxnJ.jpeg']",2025-11-29T01:49:03.000Z,2025-11-29T01:49:03.000Z,4,Shoes,shoes,https://i.imgur.com/qNOjJje.jpeg,2025-11-29T01:49:03.000Z,2025-11-29T01:49:03.000Z
44,Classic Blue Suede Casual Shoes,classic-blue-suede-casual-shoes,39,"Step into comfort with our Classic Blue Suede Casual Shoes, perfect for everyday wear. These shoes feature a stylish blue suede upper, durable rubber soles for superior traction, and classic lace-up fronts for a snug fit. The sleek design pairs well with both jeans and chinos, making them a versatile addition to any wardrobe.","['https://i.imgur.com/sC0ztOB.jpeg', 'https://i.imgur.com/Jf9DL9R.jpeg', 'https://i.imgur.com/R1IN95T.jpeg']",2025-11-29T01:49:03.000Z,2025-11-29T01:49:03.000Z,4,Shoes,shoes,https://i.imgur.com/qNOjJje.jpeg,2025-11-29T01:49:03.000Z,2025-11-29T01:49:03.000Z
45,Sleek Futuristic Electric Bicycle,sleek-futuristic-electric-bicycle,22,"This modern electric bicycle combines style and efficiency with its unique design and top-notch performance features. Equipped with a durable frame, enhanced battery life, and integrated tech capabilities, it's perfect for the eco-conscious commuter looking to navigate the city with ease.","['https://i.imgur.com/BG8J0Fj.jpg', 'https://i.imgur.com/ujHBpCX.jpg', 'https://i.imgur.com/WHeVL9H.jpg']",2025-11-29T01:49:03.000Z,2025-11-29T01:49:03.000Z,5,Miscellaneous,miscellaneous,https://i.imgur.com/BG8J0Fj.jpg,2025-11-29T01:49:03.000Z,2025-11-29T01:49:03.000Z
46,Sleek All-Terrain Go-Kart,sleek-all-terrain-go-kart,37,"Experience the thrill of outdoor adventures with our Sleek All-Terrain Go-Kart, featuring a durable frame, comfortable racing seat, and robust, large-tread tires perfect for handling a variety of terrains. Designed for fun-seekers of all ages, this go-kart is an ideal choice for backyard racing or exploring local trails.","['https://i.imgur.com/Ex5x3IU.jpg', 'https://i.imgur.com/z7wAQwe.jpg', 'https://i.imgur.com/kc0Dj9S.jpg']",2025-11-29T01:49:03.000Z,2025-11-29T01:49:03.000Z,5,Miscellaneous,miscellaneous,https://i.imgur.com/BG8J0Fj.jpg,2025-11-29T01:49:03.000Z,2025-11-29T01:49:03.000Z
47,Radiant Citrus Eau de Parfum,radiant-citrus-eau-de-parfum,73,"Indulge in the essence of summer with this vibrant citrus-scented Eau de Parfum. Encased in a sleek glass bottle with a bold orange cap, this fragrance embodies freshness and elegance. Perfect for daily wear, it's an olfactory delight that leaves a lasting, zesty impression.","['https://i.imgur.com/xPDwUb3.jpg', 'https://i.imgur.com/3rfp691.jpg', 'https://i.imgur.com/kG05a29.jpg']",2025-11-29T01:49:03.000Z,2025-11-29T01:49:03.000Z,5,Miscellaneous,miscellaneous,https://i.imgur.com/BG8J0Fj.jpg,2025-11-29T01:49:03.000Z,2025-11-29T01:49:03.000Z
48,Sleek Olive Green Hardshell Carry-On Luggage,sleek-olive-green-hardshell-carry-on-luggage,48,"Travel in style with our durable hardshell carry-on, perfect for weekend getaways and business trips. This sleek olive green suitcase features smooth gliding wheels for easy airport navigation, a sturdy telescopic handle, and a secure zippered compartment to keep your belongings safe. Its compact size meets most airline overhead bin requirements, ensuring a hassle-free flying experience.","['https://i.imgur.com/jVfoZnP.jpg', 'https://i.imgur.com/Tnl15XK.jpg', 'https://i.imgur.com/7OqTPO6.jpg']",2025-11-29T01:49:03.000Z,2025-11-29T01:49:03.000Z,5,Miscellaneous,miscellaneous,https://i.imgur.com/BG8J0Fj.jpg,2025-11-29T01:49:03.000Z,2025-11-29T01:49:03.000Z
49,Chic Transparent Fashion Handbag,chic-transparent-fashion-handbag,61,"Elevate your style with our Chic Transparent Fashion Handbag, perfect for showcasing your essentials with a clear, modern edge. This trendy accessory features durable acrylic construction, luxe gold-tone hardware, and an elegant chain strap. Its compact size ensures you can carry your day-to-day items with ease and sophistication.","['https://i.imgur.com/Lqaqz59.jpg', 'https://i.imgur.com/uSqWK0m.jpg', 'https://i.imgur.com/atWACf1.jpg']",2025-11-29T01:49:03.000Z,2025-11-29T01:49:03.000Z,5,Miscellaneous,miscellaneous,https://i.imgur.com/BG8J0Fj.jpg,2025-11-29T01:49:03.000Z,2025-11-29T01:49:03.000Z
50,Trendy Pink-Tinted Sunglasses,trendy-pink-tinted-sunglasses,38,"Step up your style game with these fashionable black-framed, pink-tinted sunglasses. Perfect for making a statement while protecting your eyes from the glare. Their bold color and contemporary design make these shades a must-have accessory for any trendsetter looking to add a pop of color to their ensemble.","['https://i.imgur.com/0qQBkxX.jpg', 'https://i.imgur.com/I5g1DoE.jpg', 'https://i.imgur.com/myfFQBW.jpg']",2025-11-29T01:49:03.000Z,2025-11-29T01:49:03.000Z,5,Miscellaneous,miscellaneous,https://i.imgur.com/BG8J0Fj.jpg,2025-11-29T01:49:03.000Z,2025-11-29T01:49:03.000Z
52,Asus zenbook,asus-zenbook,1000,"gffghjkl,chjdsdjliejjfjkjfdfihrkjklkfj",['https://media.assettype.com/thequint%2F2021-04%2F0d2aea9a-6526-47ee-ae11-ac7d79d0559f%2F2829389859692d73969d66fb977d27af.jpg?auto=format%2Ccompress&fmt=webp&width=720&w=1200'],2025-11-29T05:06:13.000Z,2025-11-29T08:54:45.000Z,3,Furniture,furniture,https://i.imgur.com/Qphac99.jpeg,2025-11-29T01:49:03.000Z,2025-11-29T01:49:03.000Z
59,Toy Car G-Wagon,toy-car-g-wagon,299,hotwheels,['https://m.media-amazon.com/images/I/91UuzyHb0oL.jpg'],2025-11-29T07:29:42.000Z,2025-11-29T07:29:42.000Z,1,Clothes,clothes,https://i.imgur.com/QkIa5tT.jpeg,2025-11-29T01:49:03.000Z,2025-11-29T01:49:03.000Z
60,iPhone 17 pro max,iphone-17-pro-max,899,Apple,['https://store.storeimages.cdn-apple.com/1/as-images.apple.com/is/iphone-17-pro-max-witb-cosmicorange-202509_FMT_WHH?wid=560&hei=744&fmt=jpeg&qlt=90&.v=UGxRWEJPajdEMXBieGEzZUtQamtWcjRidXFtV1RqWFhhcnE5ektWbjMwdlRaUlBRUlRTV1VhQk5OOFMrZTNSUWt3SFBwNUFnNDJPcXhxcHV0Ukx5WlVMQ3RlVmZ0SE53VitxRHM1Rmg1STU2V05FdFpxTzRUd3RJZ0ZFT09iZUtxVjd4cjVoQml1dzFCNVFWRy80T2tn'],2025-11-29T07:32:29.000Z,2025-11-29T07:32:29.000Z,1,Clothes,clothes,https://i.imgur.com/QkIa5tT.jpeg,2025-11-29T01:49:03.000Z,2025-11-29T01:49:03.000Z
87,telefon,telefon,100000,последен модел,['https://suindependent.com/wp-content/uploads/2023/07/Opp.png'],2025-11-29T10:48:01.000Z,2025-11-29T10:54:47.000Z,2,Electronics,electronics,https://i.imgur.com/ZANVnHE.jpeg,2025-11-29T01:49:03.000Z,2025-11-29T01:49:03.000Z
89,New Cotton Shirt2,new-cotton-shirt2,1100,Very nice and attractive,['https://placeimg.com/640/480/cotton'],2025-11-29T11:06:04.000Z,2025-11-29T11:06:04.000Z,1,Clothes,clothes,https://i.imgur.com/QkIa5tT.jpeg,2025-11-29T01:49:03.000Z,2025-11-29T01:49:03.000Z
90,Mobile Phones,mobile-phones,10,A description,['https://placeimg.com/640/480/any'],2025-11-29T11:06:08.000Z,2025-11-29T11:06:08.000Z,1,Clothes,clothes,https://i.imgur.com/QkIa5tT.jpeg,2025-11-29T01:49:03.000Z,2025-11-29T01:49:03.000Z
93,Sofa Retratil 3 Lugares,sofa-retratil-3-lugares,699,Sofa 3 Lugares,['https://www.google.com/imgres?q=Sofa%203%20Lugares&imgurl=https%3A%2F%2Freidosestofados.com.br%2Fwp-content%2Fuploads%2F15183502104_Sofa20Retratil202.0020m20-20Modelo20Compact20-20Cinza202022020-200-1.jpg&imgrefurl=https%3A%2F%2Freidosestofados.com.br%2Fproduto%2Fsofa-3-lugares-retratil-e-reclinavel-compact-200m-velusoft-cinza-202%2F&docid=uOkhT-TmVskqiM&tbnid=_BgcC1d8xG1yAM&vet=12ahUKEwiH0-K_yYGQAxVatJUCHTVDB-IQM3oECBMQAA..i&w=711&h=473&hcb=2&ved=2ahUKEwiH0-K_yYGQAxVatJUCHTVDB-IQM3oECBMQAA'],2025-11-29T12:48:51.000Z,2025-11-29T12:48:51.000Z,3,Furniture,furniture,https://i.imgur.com/Qphac99.jpeg,2025-11-29T01:49:03.000Z,2025-11-29T01:49:03.000Z
